_id,Name,Contact,Email,Phone,Website,Payment Terms,Rating,Notes
,TechSource Inc,John Miller,john@techsource.com,+1 (800) 555-4001,https://techsource.example.com,Net 30,5,Premium electronics supplier. Fast shipping.
,Office Comfort Co,Sarah Chen,sarah@officecomfort.com,+1 (800) 555-4002,https://officecomfort.example.com,Net 45,4,Quality furniture. Custom orders available.
,Paper World,Mike Johnson,mike@paperworld.com,+1 (800) 555-4003,https://paperworld.example.com,Net 15,4,Office supplies. Bulk discounts available.
,ToolMaster,Lisa Brown,lisa@toolmaster.com,+1 (800) 555-4004,https://toolmaster.example.com,Net 30,5,Professional tools. Warranty included.
,LightWorks,David Lee,david@lightworks.com,+1 (800) 555-4005,https://lightworks.example.com,Net 30,4,LED lighting specialist.
,Global Parts Co,Emily White,emily@globalparts.com,+1 (800) 555-4006,https://globalparts.example.com,Net 60,3,International supplier. Longer lead times.
,FastShip Supply,Robert Taylor,robert@fastship.com,+1 (800) 555-4007,https://fastship.example.com,Net 15,5,Express shipping. Premium pricing.
,BudgetStock,Amy Garcia,amy@budgetstock.com,+1 (800) 555-4008,https://budgetstock.example.com,Net 45,3,Budget options. Variable quality.
